likes,body,time258,"Обновлено. По информации стачкома «Беларуськалия», шахтер Олег Куделка позвонил жене и сообщил, что его силой подняли на поверхность, посадили в скорую помощь и везут в психоневрологический диспансер.",1600683049
95,❗️,1600681249
482,"По данным независимой экспертизы, неонацист Максим Марцинкевич (Тесак), обнаруженный мертвым в СИЗО, не мог сам нанести себе найденные на его теле повреждения.

СК считает, что Марцинкевич совершил самоубийство",1600679726
63,"По данным The New York Times, у задержанной также было огнестрельное оружие. ",1600677926
214,"Администратор томского отеля Xander рассказала, что соратники Алексея Навального попали в его номер с разрешения руководства гостиницы.

«Мы пошли навстречу, решили показать. Вдруг это пищевое отравление чем-то из мини-бара. Все бывает в жизни, никогда такого не было. Мы показали в моем присутствии».

После того, как стало известно, что на найденной в номере бутылке обнаружили следы вещества из группы «Новичок», отель проверил Роспотребнадзор.",1600676126
138,"До этого были отменены учения, назначенные на 20 марта и 20 июня. Следующие должны пройти 20 декабря.",1600674326
304,"Центр «Досье» изучил материалы российского и аргентинского уголовных дел о 400 килограммах кокаина в российском посольстве — и на основе свидетельских показаний и 402 часов прослушек реконструировал события наркотической поставки. На наркоторговцев - вольно или невольно - работали множество российских чиновников, утверждают они. В центре схемы — человек, который годами называл себя то сотрудником ГРУ, то сотрудником СВР. И ему верили.",1600672526
66,"Лидером по числу наград на 72-й церемонии вручения телевизионной премии «Эмми», прошедшей в Лос-Анджелесе 20 сентября, стал сериал «Хранители» — на его счету 11 наград. Еще девять «Эмми» у комедийного шоу «Шитс Крик» и семь статуэток у «Наследников». Среди производителей сериалов больше всего наград собрал канал HBO — его шоу победили в 30 номинациях.",1600670693
280,"В России качество медицинской помощи даже в одной больнице может значительно отличаться. Это прямое следствие того, что обучение врачей и проверку их знаний и навыков нельзя назвать хорошими. Проблем в этой сфере довольно много, качественно и системно они не решаются, поэтому некоторые студенты, врачи и благотворители берут дело в свои руки — создают проекты, которые помогают им самим и окружающим.",1600668293
191,"21 сентября исполняется 83 года со дня выхода «Хоббита». У переводов книг Толкина на русский язык длинная и интересная история, из-за которой фанаты могут часами спорить о том, как зовут героев, куда они идут и в каком месте происходят приключения.

Знатоки «Хоббита» и «Властелина колец», пройдите этот тест!",1600665893
60,"Спецкор «Медузы» Андрей Перцев рассказывает, каким политиком был белгородский губернатор и как побеждал на выборах сначала кандидата-коммуниста (в традиционно «красном» регионе), а позже — лидера ЛДПР Владимира Жириновского. 

Вот один эпизод из той избирательной кампании 1999 года: 

«„Был и такой случай. Перед выездом в один из районов туда отправилась „буханка“ с агитацией [за Жириновского], ее подрезал браток на красной „Ауди“. Вскоре мимо этого места проезжал кортеж Жириновского. Он вышел, подошел к братку, а тот уже ***** [сильно удивился]: ничего себе, Жириновский на разборку приехал. Лидер ЛДПР потребовал у него права и порвал их: мол, ты их купил. Охрана Жириновского столкнула „Ауди“ в кювет, а сам он поставил братка на колени. Об этом узнала вся область и восприняла негативно“, — говорит источник в ЛДПР и вздыхает»",1600662293
107,"Давайте проверим, насколько хорошо вы знаете свои лесные права. Можно ли устроить ночью в лесу вечеринку с громкой музыкой и танцами? А нарвать букетик подснежников?

Кстати, сегодня отмечается день работников леса. Будь, как дома, путник!",1600658693
113,"Герой новой книги Джоан Роулинг «Дурная кровь», убийца, — цисгендерный мужчина, который переодевается в женскую одежду. «Интересно, что критики позиции Роулинг по вопросам трансгендерности сделают с книгой, мораль которой, кажется, такова: никогда не доверяйте мужчине в платье», — написали в рецензии The Telegraph.

Роулинг уже не раз критиковали за ее высказывания о трансгендерных людях, а на этот раз в твиттере в знак протеста запустили хэштег #RIPJKRowling, под которым рассуждали о смерти ее карьеры.",1600655093
129,"С 2014 по 2019 год число возвратов приемных детей в детдома выросло почти вдвое. При этом в большинстве случаев детей решают вернуть сами приемные семьи, а не органы опеки.

MeduzaCare разбирается, почему так происходит и как можно улучшить ситуацию.",1600651493
304,"Незадолго до смерти Максим Марцинкевич жаловался адвокату на пытки: по его словам, силовики требовали от него признаться в новых преступлениях. 

Подобными сообщениями, к сожалению, никого не удивишь: заключенных и подозреваемых в России пытают очень часто. При этом в УК нет отдельной статьи за пытки, а пострадавшие боятся рассказывать о случившемся. Но даже когда жалоба есть, уголовное дело могут просто не возбудить. Если же дело доходит до суда, то в большинстве случаев заканчивается условным сроком",1600647893
50,"Проверим, много ли времени вы проводите в ютьюбе! Владимир Познер в гостях у «Ещенепознера» или «Итоги интимного стрима» от историка Евгения Понасенкова — что из этого больше похоже на правду?",1600644293
149,🏌️‍♂️🏌️‍♂️🏌️‍♂️,1600640693
70,"Лейкоз, или лейкемия, — это одно из онкологических заболеваний, при котором нарушается работа костного мозга. 

Вместе с «Фондом борьбы с лейкемией» рассказываем, что нужно делать при таком диагнозе — и чего делать не стоит:",1600637093
228,"Протесты в Беларуси не стихают, несмотря на аресты и вынужденные отъезды лидеров оппозиции. Главное дипломатическое обращение — к Венесуэле: «Заберите Сашу!»",1600633493
202,"Журналисты изучили файлы минфина США (точнее, его подразделения по борьбе с финансовыми преступлениями — FinCEN) о подозрительных транзакциях американских банков в общей сложности на два триллиона долларов. Авторы расследования называют утечку FinCEN крупнейшей в истории США утечкой финансовых документов",1600631093
61,"Новый эпизод англоязычного подкаста The Naked Pravda — о том, как изменилась белорусская пропаганда за последние годы. Почему провалилась попытка Лукашенко создать положительный образ на Западе? Как Россия влияет на белорусские государственные СМИ? Об этом Кевин Ротрок говорит с руководителем отдела расследований «Медузы» Алексеем Ковалевым и политическим аналитиком Алексом Кокшаровым.",1600623811
191,"МВД говорит, что протестующие себя агрессивно вели и «бросались на силовиков». Видеозаписей из реального мира, если что, есть какое-то количество, и можно поглядеть, кто на кого бросался (и бросался ли)",1600621411
78,"Лесные пожары на западе США продолжаются больше месяца. Из двадцатки самых крупных пожаров в истории Калифорнии пять начались в 2020 году, а для жителей крупных городов это больше всего похоже на московский смог десятилетней давности. Может показаться, что это просто стечение обстоятельств и человек (почти) не при чем. На самом деле, без разговора о глобальном потеплении не обойтись и в этом случае.",1600619011
157,"Тихановская, кажется, уверена, что российский президент правильно воспринимает действительность, в том числе слова Лукашенко про оппозицию или его заявления про закрытие границ",1600616611
62,"Никак не могу определиться, стоит ли входить сейчас на фондовый рынок? Что будет, если Мосбиржа возьмет и закроется, такое вообще возможно? И можно ли покупать акции компании, в которой работаешь? В течение целого часа отвечаем на лучшие вопросы слушателей про деньги и инвестиции — в финальном выпуске третьего сезона «Калькулятора».",1600614210
90,"Вице-премьером Уктам Барноев стал в начале 2020-го, а до этого руководил Бухарской областью. После Барноева регион возглавил на тот момент мэр Бухары Карим Камалов. Он умер от COVID-19 в августе",1600611810
62,"В подкасте «Текст недели» научные журналисты Кристина Уласович и Александр Ершов разбирают открытие ученых Кардиффского университета и объясняют, почему многие СМИ поторопились с заголовками, что на Венере найдена жизнь. А также рассказывают, как астрономы ищут жизнь за пределами Земли — и как изучению Венеры могут помочь советские разработки.",1600609410
104,"По оценке «Интерфакса», к трем часам дня в акции участвовало около десяти тысяч человек, меньше чем за час задержали 20 протестующих (по данным, опять же, ""Интерфакса"")",1600607010
100,На этой неделе плейлист «Медузы» особенно щедр на внушительные дуэты.,1600604610
142,"«Везде разруха, долги, долги, долги». Врио губернатора Хабаровского края Михаил Дегтярев два месяца ездил по региону (пока в Хабаровске протестовали да, собственно, и сейчас протестуют) и решал вопросы с генератором для поселка, ремонтом крыльца в одной школе и покупки тестомесильной машины — в другой. Теперь, говорит, поедет Путину все это рассказывать",1600602210
644,"Документалист Андрей Грязев в интервью «Медузе» рассказал о том, как составил фильм «Котлован» из 80 часов обращений россиян к президенту, найденных им в интернете:

— В фильм вошло около 150 обращений, и я не стал их компоновать по принципу «эти люди просят квартиру, эти — дорогу, эти говорят про экологию». Я монтировал по эмоциональной шкале, от безнадеги, упадничества, до юмора, абсурда. Через эти эмоциональные горки я веду зрителя к финалу на протяжении 70 минут.",1600599810
66,"В подзаголовке новой книги журналистов Андрея Солдатова и Ирины Бороган сказано, что она посвящена российской политической эмиграции и тому, как Кремль борется и взаимодействует с ней. На самом деле охват книги шире — в ней рассказано и об олигархах, которые, оставаясь в путинской России, пытаются сохранить отходные пути на Запад. «Медуза» публикует главу о Евгении Касперском и Александре Лебедеве.",1600597410
218,"Химик Вил Мирзаянов, утверждающий, что работал над «Новичком», говорит, что полное восстановление после воздействия яда займет у Навального около года (а другой химик, тоже называющий себя создателем «Новичка», уверяет, что Мирзаянов к разработке вещества не причастен)",1600591697
396,"Уже посмотрели «Довод», самый запутанный фильм Кристофера Нолана? У вас наверняка остались вопросы — и к перемещениям во времени, и к сюжетным поворотам. Мы попытались ответить на самые главные — признаемся, это было непросто!

Но если вы еще не смотрели фильм и боитесь спойлеров, не читайте этот текст — там они повсюду!",1600589297
134,"Книга Элиз Тьебо «Месячные — твое личное приключение!» выходит в конце сентября. Она рассчитана прежде всего на подростков — но взрослым тоже будет интересно. «Медуза» публикует два фрагмента из нее: о том, каким должен быть визит к гинекологу, и о том, что значит отсутствие менструаций.",1600586897
84,"Трамп одобрил достаточно компромиссный вариант сделки, речи о полном переходе TikTok под контроль американцев (этого президент США требовал изначально) не идет. ByteDance останется владельцем 80% TikTok, правда, с учетом того, какая доля в самой ByteDance принадлежит американским инвесторам, они прямо или косвенно будут владеть больше чем 20% в TikTok",1600584497
92,"С 11 по 13 сентября в России прошли выборы: в 18 регионах выбирали губернаторов, а еще — депутатов в региональные парламенты, муниципальные собрания и Государственную думу. Провластным кандидатам удалось победить как-то даже слишком легко: треть из них набрала более 80%, а второго тура не случилось даже в протестных Архангельской и Иркутской областях.

Почему так вышло и какой вклад в итоги голосования внесло «голосование на пеньке»? Разбираемся вместе со спецкором «Медузы» Андреем Перцевым и политологом Константином Гаазе.",1600576570
86,"Пока вы ждете выхода консолей нового поколения, предлагаем вам поностальгировать и вспомнить великие игры прошлого, о которых современные дети, может, даже и не слышали",1600572970
117,"На Венере нашли фосфин — вещество-биомаркер, которое может указывать на наличие жизни на планете. Что это за вещество, откуда оно берется, и пора ли нам праздновать обнаружение первой внеземной жизни? Разбираемся.",1600569370
95,"Франко Мария Риччи называли «Энцо Феррари книгоиздания» и «законодателем изящного вкуса». Он дружил с Луи Хорхе Борхесом и издавал, возможно, самые красивые книги прошлого века. 10 сентября Риччи умер в возрасте 86 лет. 

По просьбе «Медузы» журналистка Юлия Штутина о том, чем прославился дизайнер и библиофил (помимо лабиринта на своей вилле, упоминаниями о котором заполнены все поисковики)",1600565770
67,2020 год в одном заголовке,1600562170
98,"— И чем вы лечились?

 — Обычным пломбиром. 

— Мороженым?

 — Да, обычным мороженым. Это приятно и жар снимает.

Так рассказывает о своей попытке вылечиться от ковида клинический фармаколог Пироговского центра Дарья Камышова. Но болезнь у Камышовой протекала в легкой форме: сильная головная боль и повышенная температура. Обычно заболевших россиян пытались лечить препаратами. Среди них был, к примеру, и противомалярийный гидроксихлорохин, и противовирусный фавипиравир. 

Мы спросили медиков, ученых, фармацевтов и аналитиков, какие лекарства назначают при коронавирусе в России. Кажется, что по-настоящему эффективного препарата просто нет — но при этом врачам и пациентам приходится бороться за доступ к ним",1600558570
138,"Новых айфонов еще нет, но новая iOS уже есть. Совсем скоро вы сможете обновиться до свежей версии — и вот что вас в ней ждет:",1600554970
175,"Максим Марцинкевич, по собственным словам, мечтал умереть «красиво»: «Как викинг — в бою! Или на девушке. Или замерзнуть на вершине Эвереста. Хотя, по большому счету, это неважно». На самом деле его смерть получилась куда более страшной: его нашли мертвым в камере челябинского СИЗО. Официальная версия — самоубийство, но в нее не верят родные и защитники Марцинкевича, также известного как Тесак.

Спецкор «Медузы» Максим Солопов рассказывает, как Тесак стал одним из символов неонацизма России нулевых",1600551370
42,"19 сентября — день рождения смайлика, ему исполняется 38 лет. В честь праздника предлагаем вам пройти непростой тест, посвященный его потомку — эмодзи. И хотя эмодзи состоят не из знаков препинания, а представляют собой вполне четкие изображения, их значение не всегда очевидно.

Понимаете ли вы, что означают эмодзи? Сейчас проверим.",1600547770
