likes,body,time95,"В этой подборке — азиатские ужасы (очень динамичные и страшные), комедия про футбол от Apple TV+ с Джейсоном Судейкисом, история неудачливой британской актрисы, подростковая комедия об охотницах за головами и триллер о биохакинге",1599616231
330,"На кинофестивале в Венеции показали фильм «Дорогие товарищи!» Андрея Кончаловского, рассказывающий о расстреле мирной демонстрации в Новочеркасске в 1962 году.

Кинокритик «Медузы» Антон Долин рассказывает, каким получился фильм, который смотрится поразительно уместным в 2020 году.",1599614431
287,🐱🇩🇪,1599612631
58,"Ура, Microsoft анонсировала старое радио! 🎮",1599610831
93,РБК рассказал про план отступления для Лукашенко — провести реформу Конституции и новые выборы в Беларуси к 2022 году,1599609031
153,"Семнадцатилетняя девушка отправляется из провинции в Нью-Йорк, чтобы сделать аборт, — ее близкие об этом не знают. «Никогда», «редко», «иногда» или «всегда» — это варианты ответов в стандартном опроснике, который должна пройти несовершеннолетняя пациентка",1599607306
84,"«Куратор» — дебютная полнометражная работа режиссера Петра Левченко, основанная на реальных событиях.

У себя в кабинете убит мэр крупного подмосковного города. Убийца — человек из строительной сферы; одни называют его народным мстителем, другие считают, мэр мешал ему вести бизнес.
Восстановить отношения бизнеса и власти должен главный герой, друг убийцы, человек, которого называют куратором.",1599605506
48,"На, на! 🤜 Получай, коронавирус",1599603631
72,Boeing уже два года находится в глубоком кризисе из-за 737 MAX. Теперь проблемы начались и у самой успешной модели компании последних лет,1599601831
226,"В заявлении отмечается, что Германия передала в G7 информацию о проведенных клинических и токсикологических исследованиях, которые подтверждают, что Навальный был отравлен",1599600031
136,"Вечером 8 сентября в центре Минска прошла акция солидарности с членом президиума координационного совета оппозиции Марией Колесниковой. Участников акции, в том числе пожилых женщин, жестко задерживали сотрудники ОМОНа, а также люди без опознавательных знаков в масках",1599598231
387,"В этом видео Петров предложил протестующим не ходить на митинги, а объявить Москве ультиматум: или столица возвращает Фургала для суда в Хабаровске, а впридачу прощает краю все долги и выделяет дополнительно 100 миллиардов рублей «моральной компенсации» или в Хабаровске объявляют о создании Хабаровской демократической республики в составе России.

Мы поговорили с бывшим чиновником о его работе в правительстве, о причинах, заставивших его записать видео, и том, что произошло после.",1599596431
77,"Уголовное дело связано с предполагаемыми хищениями средств, выделенных в рамках госпрограммы «Энергоэффективность и развитие энергетики» на 2013-2015 годы. Всего было выделено 968 миллионов рублей, часть из них была украдена",1599594631
92,"«Я уже подал краткую жалобу на приговор суда», — сказал адвокат Эльман Пашаев",1599592831
232,"Иван Кравцов и Антон Родненков дали пресс-конференцию в Киеве, на которой рассказали, как белорусские силовики хотели вывезти из страны Марию Колесникову. По их словам, в машину, которую для отъезда подготовили силовики, были подброшены медстраховки, тесты на коронавирус и авиабилеты, чтобы «инсценировать якобы наши планы улететь за границу». Колесникова уезжать отказалась — а когда ее затащили в машину силой, порвала свой паспорт",1599591031
82,"Нейросеть GPT-3 написала колонку для The Guardian про то, что роботов бояться не надо — ведь им не хочется уничтожать человечество.
Мы попросили другую нейросеть перевести текст на русский язык.",1599589231
112,"Штаб Виктора Бабарико сообщил, что лидер штаба Мария Колесникова задержана и находится в Мозырском погранотряде. Но в погранотряде говорят, что Колесниковой там нет.",1599587431
57,"8 сентября суд вынес приговор актеру Михаилу Ефремову. За пьяную аварию, в которой погиб водитель другой машины, Ефремов получил восемь лет колонии.

Исходя из практики, это много? А экстравагантное поведение адвокатов помогло или сделало Ефремову хуже?

Обсуждаем с юридическим журналистом Алексеем Малаховским.",1599585631
104,"Римейк первых двух частей Tony Hawkʼs Pro Skater вышел настолько удачным, что можно (пока что осторожно) говорить о возрождении серии видеоигр про катание на скейтборде",1599583831
322,"Российские власти и омские медики продолжают отрицать отравление Навального, о котором заявила немецкая клиника. Но на условии анонимности члены консилиума по его лечению сказали «Медузе»: признаки отравления фосфорорганическим веществом были видны с самого начала.",1599582031
115,Задержаны не менее 10 человек. Среди них есть пожилые женщины.,1599580231
46,"Границы понемногу открываются, но мир по-прежнему не оправился от последствий пандемии. 

Напишите в комментариях, какие границы нужно немедленно открыть и почему!✈",1599579211
204,"Исследователи из нескольких стран опубликовали совместное открытое письмо авторам статьи об испытаниях российской вакцины от коронавируса.

Ученые усомнились в том, что данные об успешных испытаниях российской вакцины, представленные в статье, — подлинные. В письме говорится о статистических аномалиях, которые видны в нескольких экспериментах, описанных в статье.",1599578431
95,Как прошло оглашение приговора Михаилу Ефремову. Кадры из зала суда — и с улицы рядом с ним,1599576690
92,"Сегодня огласили приговор Михаилу Ефремову. Актера признали виновным в том, что он сел пьяным за руль и устроил аварию на Садовом кольце, в результате которой погиб 57-летний курьер Сергей Захаров.

Обвинение просило для Ефремова 11 лет колонии общего режима, судья сократила срок до 8 лет.",1599576312
360,"Волонтер штаба рассказал, что в больнице отношение врачей к пострадавшим изменилось после того, как те сообщили, что работают в штабе Алексея Навального.

По версии врачей, состояние троих пострадавших ухудшилось не из-за едкой жидкости, а из-за разных хронических заболеваний.",1599574512
126,"Интервью Лукашенко российским журналистам пока не опубликовано, но они уже рассказали, о чем шла речь",1599572712
81,"Лукашенко заявил, что член Координационного совета Мария Колесникова была задержана на границе с Украиной, пытаясь «убежать» из страны. ",1599570912
179,"А журналистов избивали, так как «это были первые горячие эмоции того времени»",1599569112
226,"«Возможно, немного пересидел», но...",1599567312
165,Михаил Ефремов после приговора — ему дали восемь лет колонии,1599565512
88,Вот как будем отдыхать в 2021 году. В ноябре целых четыре выходных подряд.,1599563802
142,"«Да, возможно, я немного пересидел. Возможно, меня показывают не только из телевизора, но и из утюга и из чайника. Но действительно только я сейчас могу защитить белорусов»",1599562002
265,Наконец-то Иван Ургант взялся за журналистские расследования!,1599560796
488,"❗️Актер Михаил Ефремов, обвиняемый по делу о смертельном ДТП на Смоленской площади в Москве, приговорен к восьми годам заключения в колонии общего режима. ",1599558996
37,"Ась? Гадаем на Моргенштерне! Только он знает, что нам еще готовит 2020 год",1599557379
126,"Собрали все, что известно о задержании одного из лидеров белорусской оппозиции Марии Колесниковой и еще двоих членов координационного совета — Антона Родненкова и Ивана Кравцова.

Материал обновляется.",1599555579
112,"Заседание началось. Суд счел вину Ефремова доказанной.

Продолжаем нашу трансляцию:",1599553779
104,"В МВД, СК и Генпрокуратуре Беларуси пока официально не комментировали обыски у журналистки.",1599553068
58,"В Пресненском суде Москвы в 11 часов начнут оглашать приговор Михаилу Ефремову по делу о смертельном ДТП 8 июня.

Обвинение просит приговорить актера к 11 годам колонии общего режима.

Мы следим за происходящим в режиме онлайн",1599551859
127,У нас есть только один вопрос: Нолан — гений?,1599550299
246,14-летнюю Алену Прокудину и еще восьмерых подростков направили в психдиспансер в Красноярске из-за подписки на паблик о массовом убийстве в школе «Колумбайн»,1599548499
153,"Пограничный комитет Беларуси и государственное агентство «Белта» сообщили о задержании члена президиума координационного совета оппозиции Марии Колесниковой на границе с Украиной. По их версии, Колесникова, которая пропала в центре Минска утром 7 сентября вместе с другими членами совета Антоном Родненковым и Иваном Кравцовым, пыталась незаконно пересечь границу в ночь на вторник. Родненков и Кравцов сейчас на Украине.",1599542186
103,"В конце прошлого года саудовский суд вынес смертные приговоры пятерым обвиняемым в убийстве журналиста Джамаля Хашогджи. Теперь казнь заменили на 20-летние тюремные сроки — потому что сыновья Хашогджи заявили, что прощают виновных в убийстве отца.",1599533313
128,"Шерлок Холмс в России! Ватсона нет, но есть «русский Мориарти», которого играет Константин Богомолов.",1599529713
255,"Нолан: на баклажан нажал кабан
Все: 🤔🤔🤔",1599526113
207,С сайта «Спутника» пропала строка для ввода поисковых запросов. Теперь там находятся только ссылки на другие разработки компании,1599522513
186,"В результате действий террориста погибли 39 человек, в том числе одна гражданка России, 65 человек получили ранения",1599518913
75,В ближайшее время ожидаются поставки первых партий вакцины в регионы,1599515313
146,"Уволенные работники подчеркивают, что официальные обращения в адрес президента, в прокуратуру, к членам правительства и в трудовую инспекцию результата не дали, а судебные решения о взыскании долгов с работодателя не исполняются",1599511713
136,"Суд оштрафовал петербуржца за то, что он в трехдневный срок не отчитался о прохождении теста на коронавирус после возвращения из-за границы",1599508113
161,"«Ему не нравилась я, ему не нравился наш дом. Он даже детей оскорблял: старшей дочери, Маше, муж как-то сказал: ""Тупая, как мой капот от «Гелендваген»"". А она закончила школу с золотой медалью, поступила в институт. Она его слова на всю жизнь запомнила».",1599506313
158,"Поиски начались после того, как родные Колесниковой подали заявление о ее пропаже",1599504513
138,"Вышла первая игровая картина о событиях октября 2002 года, когда террористы захватили Театральный центр на Дубровке в Москве.

Кинокритик Антон Долин рассказывает, как режиссеру удалось впервые в художественном кино коснуться этого события и, не погружаясь в политику, поговорить со зрителями об этой травме.",1599502713
346,Около десяти утра люди в гражданской одежде и в масках схватили Колесникову в центре Минска и затащили ее в темный микроавтобус с надписью «Связь». С тех пор о ее местонахождении ничего не известно,1599500911
226,Вместе с вами собрали ультимативный плейлист для прогуливания занятий,1599500100
207,"«Совершенно недопустимо, что было использовано запрещенное химическое оружие. Россия должна провести тщательное транспарентное расследование», — заявил глава МИД Великобритании Доминик Рааб",1599499111
313,"В июне 2020 года СК переквалифицировал дело со 105-й («Убийство») на 108-ю статью УК («Убийство, совершенное при превышении пределов необходимой обороны»).

Но поскольку ответственность по этой статье наступает с 16 лет, СК подал в прокуратуру постановление о прекращении уголовного дела в отношении школьницы",1599497308
455,"Этот выпуск набрал более 200 тысяч дизлайков.

Самый популярный комментарий под ним — от белорусского издания Tut.by: «Позорище. У нас люди погибают. Десятки сидят — в том числе и наши журналисты. И вы считаете это смешным».",1599495508
164,"В Перми на два года колонии осудили блогера, который устроил перформанс с куклой Путина.

Почему силовикам было принципиально добиться реального наказания для автора акции? В чем состоят странности процесса? И как пермяки в ответ на приговор создали в городе гражданский Комитет за свободу мнений?",1599493708
114,"«Я не верю, что это некорректное письмо мне написали Вы. Мне о Вас рассказывали другое», — написал Рошаль Навальной",1599491908
189,"Писатели выпустят сборник рассказов «Дом» в поддержку благотворительной организации «Ночлежка», помогающей бездомным. 

Уже запущена краудфандинговая кампания",1599490108
315,"Тем временем на федеральных телеканалах своя атмосфера. Максимально коротко пересказываем, что там говорят о Навальном",1599488308
50,"В кино идет «Довод», новый фильм Кристофера Нолана. Он снял «Начало», «Интерстеллар», «Престиж», три фильма о Бэтмене и не только. 

А еще Нолан — герой мемов, в которых его просто называют гением (всем бы так). Сейчас выясним, заслуживает он этого звания или нет",1599487680
275,"Представляем трейлер фильма Андрея Кончаловского «Дорогие товарищи!». Картину, которая рассказывает о расстреле мирной демонстрации в Новочеркасске в 1962 году, покажут на Венецианском кинофестивале сегодня.",1599486613
1439,"Его состояние улучшилось, сообщают врачи",1599484708
812,"1 сентября заместитель начальника отдела в Управлении делами президента Беларуси Анатолий Котов опубликовал в своем фейсбуке заявление об увольнении, написав бывшим коллегам, что не понимает, как они теперь спят по ночам — после историй с избиениями и пытками людей в стране.

Спецкор «Медузы» Максим Солопов поговорил с Котовым о причинах политического кризиса в Беларуси, настроениях среди белорусских чиновников, возможности раскола в окружении Лукашенко, программе оппозиции и возможных сценариях дальнейшего развития событий в стране.",1599483197
183,Том Круз 💪💪💪,1599479596
136,"Я перестану смотреть тикток и начну работать я перестану читать фейсбук и начну работать я не зайду в инстаграм пока не закончу отчет а-а-а-а помогите

Это партнерский материал",1599477796
92,"Врач Владимир Будянский дал экспертный комментарий для материала «Медузы» от 20 марта об аппаратах ИВЛ в России.

СК в ходе доследственной проверни не нашел доказательств вины Будянского.",1599475996
99,"Хорошо, что делать мемы об этих «переговорах» могут не только спецслужбы",1599474196
146,😟😟😟,1599473541
139,"По-прежнему непонятно, кто именно задержал Марию Колесникову",1599472202
68,"«Фактически Apple ведет дискриминационную политику по признаку гражданства разработчиков для целого ряда стран, включая Россию», — считает депутат Антон Горелкин",1599470402
121,"По данным МВД Беларуси, на акциях протеста в воскресенье были задержаны 633 человека. Численность протестующих ведомство оценило в 31 тысячу человек. По данным СМИ, людей было не менее 100 тысяч.",1599468602
205,"Члена президиума Координационного совета белорусской оппозиции, лидера штаба Виктора Бабарико Марию Колесникову неизвестные люди посадили в микроавтобус с надписью «Связь» увезли в неизвестном направлении.",1599466747
