likes,body,time
65,"Вышел второй выпуск нашего ютьюб-шоу #скажигордеевой. Катерина Гордеева говорит с Наталией Мещаниновой, автором сценария «Аритмии», одного из самых популярных российских фильмов последних лет.

https://youtu.be/YwDutgE5-cY

В этом выпуске:

➤ Как найти в себе силы говорить о пережитом в детстве сексуальном насилии и начать помогать другим жертвам

➤ Как снять мужа в эротической сцене

➤ Сколько платят в российском кино

Подписывайтесь на наш канал в ютьюбе и нажимайте на колокольчик, чтобы не пропустить новые выпуски!

https://youtu.be/YwDutgE5-cY",1601026960
98,Что происходило в юбилейный день белорусских протестов,1601229108
58,"В подкасте «Текст недели» обсуждаем материал медицинского редактора «Медузы» Дарьи Саркисян о том, кто и как учит врачей в России. Почему у нас по-прежнему много специалистов, которые назначают препараты с недоказанной эффективностью? Как современные медики пытаются изменить ситуацию и помогают обучать коллег? И кстати – как понять, что перед вами квалифицированный врач?",1601226847
191,"В столице Беларуси и на ее окраинах появились целые ""протестные дворы"" - соседи там выражают свое несогласие с властью, рисуют оппозиционные муралы - а потом, когда их закрашивают, рисуют заново, а потом опять и опять - а также организуют флешмобы и устраивают концерты.

Корреспонденты «Медузы» посмотрели на спальные районы Минска, которые проснулись",1601224447
56,"Президент России обсудил ситуацию в Нагорном Карабахе с премьер-министром Армении Николом Пашиняном. Владимир Путин отметил, что нужно не допустить дальнейшей эскалации конфликта и, главное, прекратить военные действия, начавшиеся утром 27 сентября.",1601222047
69,"В УВД заявили, что спецсредства применялись из-за того, что демонстранты «предприняли попытку радикализации протестной акции, попытались прорвать цепь сотрудников милиции».",1601219647
88,На фоне нового обострения конфликта в Нагорном Карабахе в ряде регионов Азербайджана вводится военное положение. В Баку будет действовать комендантский час. Ранее военное положение и всеобщая мобилизация объявлялись в Армении и непризнанной Нагорно-Карабахской республике.,1601217247
99,"Премьер-министр Армении выступил со специальным обращением к нации из-за очередного обострения в Нагорном Карабахе. Никол Пашинян призвал не допустить вмешательства Турции в конфликт, которая обещала в случае необходимости выступить на стороне Азербайджана.",1601214847
165,"В 50-й день протестов в Беларуси демонстранты намерены провести «народную инаугурацию» Светланы Тихановской, противостоявшей Александру Лукашенко на выборах президента. Днем 27 сентября в Минске на проспекте Победителей у стелы «Минск — город-герой» вновь стали собираться протестующие. Милиция задержала нескольких участников акции. ",1601212447
368,"— Ну, ребят, слушайте, на ваши звонки уже даже престарелые бабки не ведутся. Может, хватит уже? Придумали бы что новое.
— Да *****, а что придумать-то?! Попробуйте предложить что-то свое! Критиковать все горазды!

Недавно мы попросили вас присылать нам интересные и смешные диалоги с мошенниками, которые представляются сотрудниками банков. Вы постарались на славу.

Вот лучшее из присланного.",1601210047
111,"Что известно на данный момент об очередном обострении в Нагорном Карабахе: Армения и Азербайджан ведут боевые действия с применением танков, авиации и артиллерии. Обе стороны обвиняют друг друга в провоцировании конфликта. По предварительным данным, с обеих сторон есть жертвы и раненые. В Баку заявили, что взяли под контроль семь сел на линии соприкосновения. В Ереване и Степанакерте это опровергают.",1601207647
48,"В свежем выпуске нашего еженедельного плейлиста провокационный Хаски, возвышенный Стивенс, пронзительный «Мегаполис», нестареющие Public Enemy, боевые Idles и многие другие.",1601203210
94,Дональд Трамп заранее грозится не признать свое поражение на выборах. А как он может это сделать? И что тогда будет? Журнал The Atlantic рассмотрел все возможные сценарии — вплоть до явления на инаугурацию обоих кандидатов в президенты и фактического развала страны,1601200810
166,"После того, как утром 27 сентября Нагорный Карабах подвергся массированному обстрелу, военные Армении и Азербайджана обвинили друг друга в провокации и начали боевые действия. В непризнанной республике и Армении объявлены военное положение и всеобщая мобилизация.",1601198407
83,"48-летняя Эми Кони Барретт — убежденная католичка, придерживающаяся консервативных взглядов и, в частности, выступающая против абортов. В случае утверждения Сенатом она станет самым молодым членом Верховного суда США.",1601196007
111,"В Москве за сутки выявлены 2016 новых случаев заражения коронавирусной инфекцией, а всего по России — 7867. Это максимальное значение с середины июня.",1601193607
22,"Автор англоязычного подкаста The Naked Pravda Кевин Ротрок поговорил с историком Шоном Гиллори о личности американского ученого Стивена Коэна, который умер 18 сентября в США в возрасте 81 года.

Коэн известен прежде всего работами по советской истории. Одна из главных его книг — политическая биография Николая Бухарина. Труды Коэна повлияли на осмысление сталинизма в годы перестройки. При этом в последнее время историк был любимцем путинской пропаганды: разделял позицию Кремля во время российско-украинского конфликта 2014 года и критиковал позицию США о российском вмешательстве в президентские выборы.",1601192420
574,"«Если Белтелерадиокомпания не хочет показывать людям правду, ее покажем мы», — заявили белорусские киберпартизаны и запустили в трансляции на сайтах госканалов ролики, на которых запечатлены избиения и задержания мирных протестующих в Минске. Но до телеэфира хакеры пока не добрались.",1601190020
129,В Нагорном Карабахе очередное обострение военного конфликта между Арменией и Азербайджаном. Утром 27 сентября населенные пункты в регионе подверглись интенсивному обстрелу. Обе стороны обвиняют друг друга в провокации.,1601187617
165,"26 сентября — 61 год со дня рождения поэта и переводчика Ильи Кормильцева, автора текстов лучших песен группы «Наутилус Помпилиус». Он умер в 2007 году, а к десятой годовщине смерти Кормильцева вышла биографическая книга журналиста Александра Кушнира «Кормильцев: космос как воспоминание». По ссылке вы можете прочитать две главы из книги — о том, как «Наутилус» распался на вершине популярности, а сам Кормильцев подался в спелеологи и бизнесмены.",1601184097
375,"В российском здравоохранении много проблем — часть из них стала особенно ярко видна в пандемию ковида. Причем проблемы начинаются уже со студенческой скамьи. В вузах не дают важных знаний: например, многие преподаватели скептически относятся к доказательной медицине, студентов не учат общению с пациентами и английскому языку (на котором публикуются мировые исследования). Сложности продолжаются и в ординатуре, и после получения диплома. 

К счастью, в последнее время в медицинской среде появляется все больше людей, которые не просто недовольны таким положением дел, но и активно пытаются его исправить, что называется, «снизу»: переводят англоязычные материалы и занимаются просвещением коллег. В этом большом материале мы рассказываем о таких студентах, врачах и благотворителях",1601180497
272,"Год назад мы запустили наш подкаст о русском языке «Розенталь и Гильденстерн», который ведут журналист Александр Садиков и главный редактор «Грамоты.ру» Владимир Пахомов. И вот недавно начался уже четвертый сезон!

Повод вспомнить материал с целой сотней фактов о русском языке. Из него вы узнаете, например, что раньше слово «метро» было мужского рода, а слово «бабки» появилось благодаря Екатерине Второй",1601176897
68,Наконец-то с разбитым сердцем можно будет что-то сделать,1601173297
57,"Автомобильное издание «Авторевю» заинтересовала машина курьера Сергея Захарова, погибшего в аварии с Михаилом Ефремовым. Журналисты осмотрели ее и пришли к выводу, что Захаров не был пристегнут — хотя судмедэксперт утверждала обратное. Они провели краш-тест и предположили, что шансов выжить у водителя фургона Lada Granta практически не было. Мы расспросили «Авторевю» о результатах их исследования",1601169697
76,"Сейчас расскажем, что делать с этой осенней напастью",1601166097
101,"У документалиста из Израиля Влади Антоневича, автора фильма о русских неонацистах «Кредит на убийство», есть своя версия гибели Максима «Тесака» Марцинкевича. 

Четыре года назад он заявил о причастности Тесака к жестокому двойному убийству — видеозапись этого преступления русские неонацисты опубликовали в 2007-м под названием «Казнь таджика и дага». 

Спецкор «Медузы» Максим Солопов поговорил с Антоневичем о том, как режиссер пришел к своим выводам, а также о том, как это может быть связано с президентскими выборами 2008 года.",1601162497
141,26 сентября отмечается Всемирный день контрацепции. Есть повод вспомнить одну нашу полезнейшую инструкцию,1601158897
172,"«Яндекс» собирается купить «Тинькофф банк» за 5,5 миллиарда долларов. Это, возможно, главная российская сделка года. Зачем она Олегу Тинькову? А «Яндексу»? А откуда у покупателя деньги? И чего теперь ждать клиентам банка и пользователям сервисов «Яндекса»?

Отвечаем на все вопросы",1601155297
66,"Главный подозреваемый во вчерашнем нападении возле бывшей редакции французского сатирического журнала Charlie Hebdo — 18-летний выходец из Пакистана. Он заявил, что хотел отомстить за карикатуры на пророка Мухаммеда, которые Charlie Hebdo опубликовал в 2015 году (из-за них в редакции журнала произошел теракт) и снова напечатал недавно (из-за начала суда по делу о теракте).",1601151697
110,"При крушении самолета Ан-26 под Харьковом выжил один человек (из 27, находившихся на борту). Вот что он помнит о катастрофе",1601149297
38,23 сентября в России стартовали продажи умных часов Apple Watch Series 6. Журналист «Медузы» Максим Иванов получил тестовый образец раньше и рассказывает о недельном опыте использования часов.,1601146897
170,"Эксперты Высшей школы экономики оценили, насколько пандемия сократила российский средний класс",1601144497
66,Незарегистрированная партия «Другая Россия» объявила о самороспуске. Вместо нее последователи Эдуарда Лимонова создадут новую партию под названием «Другая Россия Э. В. Лимонова».,1601142097
46,"Ребенок отказывается идти в школу, а заставлять его уже надоело? А что если перевести его на домашнее обучение? В финале сезона нашего честного подкаста о материнстве «Ты же мать» говорим с мамой, которая разрешила своему сыну учиться дома (и не пожалела об этом!).",1601139697
218,"В 1964 году в Польшу приехал Джеймс Альберт Бонд — за ним немедленно установили слежку из-за подозрений в шпионаже. Его вдова утверждает, что Бонд действительно работал на спецслужбы. К этому моменту вышло уже 11 книг и два фильма об агенте 007!",1601137736
16,"Если вы все еще не установили наше новое приложение, самое время сделать это!

Что в нем есть:
 
➤ Три ленты: 🔸основной поток новостей и статей; 🔸лента подкастов, 🔸вкладка «Гипноз», где можно залипнуть, если дочитали основную ленту до конца. 
 
➤ Улучшенные закладки. Если сохранить статью на одном телефоне, она появится и на другом (ну, или на планшете)
 
➤ Конструктор сториз, где можно сделать красивую картинку с кусочком текста и сразу расшарить в инстаграме

Чего в нем нет:

➤ Ботов

— Версия для айфонов и айпадов: https://mdza.io/jTVPVpHqgF8 
 
— Версия для Android: https://mdza.io/HFRM4ny5IRU",1601136240
113,"Сегодня в Минске прошла очередная женская акция протеста. На ней, по данным правозащитников, задержали не меньше 70 человек",1601135335
85,Проект «ОВД-Инфо» сообщил о первом уголовном деле против участника акций в поддержку бывшего губернатора Хабаровского края Сергея Фургала,1601135247
69,Единственый выпуск рассылки «Вечерний Долин». https://meduza.io/brief/2020/09/26/vecherniy-dolin,1601133521
69,"Литературный критик Галина Юзефович рассказывает о романе прозаика и эссеиста Алексея Поляринова «Риф». В нем переплетаются сюжетные линии трех героинь: одна живет на севере, другая в США, третья — в Москве. Это по-настоящему «читательский» (то есть написанный читателем и написанный для читателя) роман.",1601131769
132,Задержание участницы сегодняшнего женского марша в Минске,1601129369
85,"Коронавирус снова с нами: вчера власти Москвы рекомендовали пожилым и людям с хроническими заболеваниями вернуться на самоизоляцию, сегодня так же поступили власти Подмосковья",1601126969
44,"На этой неделе в кино идет биографический фильм «Стрельцов» с Александром Петровым в роли знаменитого футболиста, семейная драма «Гнездо» с Джудом Лоу и еще несколько интересных картин.",1601124569
96,"С 2000 года главный хит всех белорусских протестов, да и просто самая популярная песня на белорусском языке — «Тры чарапахi» минской рок-группы N.R.M. Ее поют и оппозиция на митингах, и футбольные фанаты на трибунах. Хотя в ней почти нет никаких революционных намеков, кроме альтернативного варианта припева, появившегося во второй половине 2000-х. Вместе с одним из авторов песни и белорусским музыкальным критиком выясняем, как так вышло.",1601122169
116,"В Минске в два часа дня началась еженедельная женская акция протеста. Ее участниц сразу стали задерживать. В прошлую субботу, напомним, белорусские силовики задержали несколько сотен участниц женского марша",1601119769
67,"Вчера вечером в Харьковской области Украины разбился военно-транспортный самолет Ан-26. На его борту были 27 человек. По предварительным данным, 26 из них погибли. Одному человеку удалось выжить. Сообщается, что он выпрыгнул из самолета на небольшой высоте (с ним выпрыгнул еще один пассажир, но он позже умер в больнице)",1601117802
82,"Кажется, Конор Макгрегор снова передумал завершать карьеру",1601116505
159,За последние сутки в России выявили 7523 новых случаев коронавируса. В предыдущий день прирост составил 7212 новых случаев. До этого суточный прирост свыше семи тысяч не наблюдался с 28 июня.,1601112905
140,В Москве за последние сутки выявили 1792 новых заболевших COVID-19. Это рекорд с 8 июня,1601110468
58,"Сложный тест о средневековом быте москвичей. Попробуйте не перепутать кресала, совни и крицы! Если не получится — ничего страшного, все расскажут археологи Музея Москвы.",1601108738
