likes,body,time213,"«Я был участником и свидетелем внешнеполитической работы в правильном направлении: готовность к диалогу с разными сторонами, переговоры, многовекторность внешней политики, открытие страны. Определенный процент косяков и странностей в государственном управлении можно было принимать, потому что все равно мы двигались куда-то вперед: 2015 год был лучше, чем 2010-й, 2018-й — лучше, чем 2015-й, 2019-й год с точки продвижения имиджа Беларуси на международной арене был вообще фееричен. <...> Но если последние события — это и есть то, ради чего мы шли вперед, то я с этим курсом категорически не согласен и не хочу в этом никоим образом участвовать. Не понимаю, как можно было в XXI веке в абсолютно европейской стране дойти до убийств безоружных граждан, массового избиения и пыток и даже не попытаться потом извиниться. Для меня это за гранью»",1600062726
84,"Еще в июле Марина Чайка рассказывала, что испытывает давление со стороны мужа Артема, сына бывшего генпрокурора Юрия Чайки. Он угрожал отнять детей, забрал ее документы, в том числе паспорт.

Суд развел супругов, однако Артем подал апелляционную жалобу на это решение, ее будут рассматривать 17 сентября. Спецкор «Медузы» Светлана Рейтер поговорила с Мариной Чайкой о браке и разводе с мужем.",1600059125
220,"Непросто добраться до угощения, когда у тебя — ни головы, ни ножек",1600055525
256,"7 сентября, Алексея Навального вывели из медикаментозной комы. Несмотря на это, Россия продолжает отрицать сам факт отравления, ссылаясь на результаты анализов.

Как выяснила «Медуза», врачи, наблюдавшие Навального в Омске, сразу определили у него симптомы отравления нервно-паралитическим агентом — однако постановку диагноза осложнило то, что комплекс симптомов был не вполне классическим для отравления ФОС (некоторых симптомов как будто не хватало, другие оказались нетипичными). Эксперты по химоружию считают, что отравление агентами из группы «Новичок» вполне может иметь смазанную клиническую картину.",1600051925
56,Без лишних слов: гадаем на Моргенштерне!,1600048325
273,"Легендарный сливовый пирог из The New York Times очень просто приготовить. Вот тот самый рецепт 1983 года, который читатели газеты просили публиковать из года в год:",1600044725
273,"Фильм Андрея Кончаловского «Дорогие товарищи!» получил специальный приз жюри на прошедшем Венецианском кинофестивале.В основу картины легли события, которые были засекречены несколько десятилетий. В 1962 году в Новочеркасске рабочие, недовольные повышением цен и понижением зарплат, объявили забастовку и вышли на демонстрацию. Военные стреляли по толпе боевыми патронами, в результате чего погибли 26 человек, сто пострадали, семерых, названных зачинщиками, приговорили к расстрелу.

Кинокритик Антон Долин рассказывает, каким получился этот фильм об отношениях народа и власти.",1600041125
132,"«Отравители достигают своих смертоносных целей втайне. Улики в деле об отравлении почти всегда являются косвенными… Отравления — не из числа преступлений, совершаемых в порыве страсти, импульсивно. Такое преступление не может не быть заранее спланировано», — пишет австралийский писатель Питер Макиннис, автор книги «Тихие убийцы. Всемирная история ядов и отравителей».

Колумнист The New York Times, редактор The Russia File и «Медузы» Максим Трудолюбов рассказывает, как покушение на Навального делает отношения между обществом и властью в России еще более токсичными и рекомендует литературу по этой теме. ",1600037525
94,Свежие релизы в еженедельном плейлисте от «Медузы»,1600033925
182,"Протесты в Беларуси, день 36. Демонстранты в Минске впервые отправились в Дрозды — элитный поселок для высших чиновников рядом с резиденцией Александра Лукашенко. Несмотря на то, что большинству протестующих путь преградило оцепление, некоторым все-таки удалось дойти до Дроздов. И оставить плакаты у дома главы ЦИК",1600030325
135,"Кратко об итогах Единого дня голосования-2020: опять многодневные выборы в том числе «на пеньке», везде победили действующие главы регионов и почти везде — единороссы, но не обошлось и без неожиданностей.",1600028652
52,"Игру Marvel's Avengers стоит поругать за однообразных врагов и еще более однообразные уровни. Но как киноблокбастер про Мстителей она вполне себе работает — особенно если учесть, что фильмов Marvel в этом году пока не было",1600027639
221,"В попытках задобрить китайское правительство и получить доступ к ключевому рынку создатели фильма «Мулан» в финальных титрах поблагодарили власти Синцзян-Уйгурского автономного района, в котором проходили съемки. Но не учли, что там же находятся «лагеря перевоспитания» для этнических уйгуров — и получили очередную волну критики в соцсетях и СМИ. Фильм при этом в китайском прокате провалился.",1600024039
306,Протесты в Минске. День 36-й. Вот как это выглядело,1600020439
326,"В Минске и других городах Беларуси проходят массовые митинги. В столице протестующие направляются к поселку Дрозды, где находятся дома руководства страны, в том числе одна из резиденций Александра Лукашенко. Мы ведем онлайн.",1600010062
88,"Спецкор «Медузы» Ирина Кравцова в подкасте «Текст недели» рассказывает историю девочки-подростка из Красноярска, которую принудительно отправили в психдиспансер, — вероятно из-за того, что она была подписана на паблики, где обсуждалось массовое убийство в школе «Колумбайн». Зачем ФСБ проводит обыски у детей и как силовики убеждают родителей отправить подростков в психдиспансер? И почему до сих пор не ясно, в чем именно подозревают ребенка?",1600007662
385,"В Минске снова собралась массовая акция протеста. Ее участники идут к элитному поселку Дрозды, где живет Лукашенко и высокопоставленные белорусские чиновники",1600005262
339,"«В движении «Голос» такого массового потока сообщений о демонстративном пренебрежении правом, в том числе правом наблюдателей и членов комиссий, не получали на протяжении последних 4 лет».",1600003287
61,"Кинокритик «Медузы» Антон Долин подводит итоги Венецианского фестиваля (жюри отдало предпочтение в большинстве пока еще не слишком известным режиссерам) и рассказывает, как проходил сам смотр в условиях пандемии: на показ — только в маске, несколько раз за день — измерение температуры.",1600002606
96,"СК заявил, что глава отделения партии «Справедливая Россия» в Новороссийске Михаил Ерохин получил взятку в 2 миллиона рублей. Взамен он якобы пообещал, что «подконтрольные ему граждане» не будут препятствовать проведению выборов",1600000206
121,В Минске силовики разгоняют участников акции протеста. Людям не дают собраться в большую колонну в центре города,1599997806
66,"В сентябре вышла книга Алексея Иванова «Быть Ивановым». В нее вошли диалоги автора с читателями — с 2005 года он отвечает на вопросы аудитории на разных площадках. Мы расспросили писателя, отсеивает ли он вопросы с критикой, почему не комментирует актуальные события вроде протестов в Беларуси или ситуации с Навальным, и чем плохи соцсети.",1599997454
218,"Пять близких к Кремлю источников агентства Bloomberg рассказали, что Путин не верит в свержение Лукашенко. Хотя масштаб протестов против него стал для российского руководства сюрпризом",1599995054
141,В Минске сегодня запланирована очередная массовая акция против Александра Лукашенко. Силовики уже перекрыли главные площади города и начали задерживать людей с бело-красно-белыми флагами,1599992654
228,"Дженнифер Уорф начинала работать медсестрой в середине XX века. Она видела, как люди старшего возраста, если случался инфаркт или инсульт, мирно умирали дома или в больничной койке. Со временем это изменилось: ко всем подряд стали применять новейшие достижения медицины и реанимировали даже тех, чье качество жизни в результате сильно ухудшалось. Во многом это сохранилось до сих пор. В книге «Посреди жизни», которая выходит в издательстве «Лайвбук», Дженнифер Уорф описывает разные подобные случаи, свидетелем которых она была: некоторые заканчивались хорошо, некоторые — нет.
«Медуза» публикует главу, посвященную врачу Сисли Сондерс — она одной из первых начала специализироваться на уходе за умирающими.",1599990963
80,"ЦИК рассказал, в каких регионах России наблюдалась самая высокая и самая низкая явка на выборах губернатора в первые два дня трехдневного голосования",1599988563
80,"18 августа на пути российской автоколонны в Сирии сработала самодельная бомба. Погиб генерал-майор, еще двое военнослужащих получили ранения. Теперь раненых из умер в госпитале, сообщил источник ТАСС",1599983672
173,,1599983605
78,"Ночью в Краснодаре загорелась мансарда восьмиэтажного жилого дома. Площадь пожара превысила 4 тысячи квадратных метров. Жильцы дома были эвакуированы. По предварительным данным, никто не пострадал.",1599980072
67,Белоруска Виктория Азаренко проиграла японке Наоми Осаке в финале US Open. Осака выиграла турнир уже во второй раз,1599978628
324,"В Беларуси продолжаются протесты — и одним из их символов по-прежнему остаются белорусские женщины. На одной из акций солидарности силовики, которые обычно задерживали только мужчин, начали задерживать женщин с детьми. 

Минский фотограф Евгений Ерчак сделал снимок, на котором группа женщин, сцепившись локтями, смотрит на силовика в форме без опознавательных знаков. Мы поговорили с журналистом о том, как была сделана эта фотография и что стало с ее героинями.",1599969467
112,"С 2024 года фильм, претендующий на победу в главной номинации «Оскара», должен будет соответствовать новым стандартам — их на неделе опубликовала киноакадемия. Новость об этих требованиях наделала много шума, но, судя по всему, привести фильм в соответствие новым критериям будет просто. Да еще и так, что зритель этого не увидит. ",1599965867
332,"На этой неделе в Екатеринбурге одновременно проходят два мероприятия: Ural Pride Week, организованная Ресурсным центром для ЛГБТ, и ярмарка «Скрепа», которую проводит консервативное движение «Сорок сороков». 

В центре города появились патрули из людей, которые называли себя казаками — а руководители местных казачьих организаций заявили, что не имеют к ним отношения. Патрульные начали останавливать людей, чью внешность посчитали слишком яркой.

Год назад у нас выходил материал о том, кто такие современные казаки (и как мало у них общего с казаками из давних времен), чем они занимаются, есть ли у них какие-то привилегии и насколько законны их действия — например, во время разгона митингов.",1599962267
71,"Во вторую субботу сентября отмечается Всемирный день оказания первой помощи. У нас выходил тест, который покажет, сможете ли вы помочь человеку в самых разных ситуациях. Например, если он не дышит или у него начались судороги.",1599958667
105,"13 сентября в России пройдет единый день голосования. В 18 регионах будут выбирать губернаторов, в 11 — депутатов местных парламентов, в 22 столицах регионов пройдут выборы в городские советы. Далеко не во всех случаях исход предрешен. А в некоторых регионах мы увидим в действии новые партии, созданные Кремлем. 

Спецкор «Медузы» Андрей Перцев рассказывает о выборах, где будет настоящая интрига — например, в традиционно протестной Архангельской области, которая стала такой еще до Шиеса.",1599955067
76,"Инструкция о том, как правильно выбрать лекарство и не купить подделку. А также что делать, если вдруг что-то пошло не так.",1599951467
53,"Актера Михаила Ефремова приговорили к восьми годам колонии за смертельное ДТП. Вместе с юридическим журналистом Алексеем Малаховским обсуждаем странную тактику защиты актера и то, как она повлияла на приговор. Мог ли он быть мягче, если бы Ефремов сразу признал вину? Вообще восемь лет при максимальном наказании в 12 лет и всех обстоятельствах дела — это много или мало?

Обо всем этом — в выпуске подкаста «Что случилось»:",1599947867
258,"В 256-й день года отмечается день программиста. 2020-й год — високосный, и поэтому праздник выпал на 12, а не 13 сентября. Повод снова запостить наши карточки о том, как научиться программировать. Способов начать изучать языки невероятно много. Самое сложное — не опустить руки при первых трудностях.",1599944267
80,Наш классический тест про Ренессанс и великих художников этой эпохи.,1599940667
72,👹👹👹,1599937067
107,Главная награда — у фильма «Земля кочевников» с Фрэнсис Макдорманд. Фильм Андрея Кончаловского «Дорогие товарищи!» получил Специальный приз жюри,1599934666
65,"Испытания были приостановлены 6 сентября. Британские власти провели расследование, по итогам которого заключили, что их можно безопасно продолжать",1599934153
125,"Организаторы конкурса подчеркнули, что не выступают за вынос тела Ленина из мавзолея — а просто ""пытаются архитектурно осмыслить, как можно использовать мавзолей в той самой ситуации, когда все-таки через 50 лет тело Ленина вынесут"".",1599931753
76,"Увы, ни во время знакомства с игроками, ни во время прощания Ресторатор так и не призвал присутствующих в студии пошуметь:(",1599929353
61,"Рассказываем о двух английских романах, которые впервые вышли на русском языке. Не исключено, что интерес к ним проснулся благодаря кино: совсем недавно вышел «Грейхаунд» по сценарию Тома Хэнкса, а по другому роману автора «Как стать леди» сняли «Таинственный сад». Но книги, кажется, лучше!",1599926953
180,"«Женский марш» протеста против Александра Лукашенко в центре Минска проходил третью субботу подряд. Предыдущие акции обходились без массовых задержаний, но на этот раз сотрудники ОМОНа и неизвестные в балаклавах без опознавательных знаков задержали более 30 участниц марша",1599924553
86,"С помощью голосового меню мошенники узнавали остатки на счетах клиентов. После этого они звонили клиентам, представляясь сотрудниками банка - и имеющаяся у них информация о состоянии счетов помогала быстрее войти в доверие к жертвам",1599922153
99,"Уже 15 лет в арт-парке «Никола-Ленивец» под Калугой проходит фестиваль «Архстояние». Все эти годы приглашенные архитекторы и художники строили на территории причудливые объекты, которые определенно стоит увидеть. Рассказываем о десяти самых интересных достопримечательностях парка, появившихся там благодаря «Архстоянию».",1599919753
108,"Наименьшая явка в первый день голосования зафиксирована на выборах губернатора Иркутской области — 8,11%.",1599917353
122,"Задержания были жесткими, их проводили сотрудники ОМОНа и неизвестные люди в балаклавах без опознавательных знаков.",1599914953
50,"На этой неделе наконец-то вышла «Мулан»! Римейк, который так долго ждали все поклонники одноименного диснеевского мультфильма. Но если вам не нравятся голливудские сказки, можно посмотреть «Ассистентку» с Джулией Гарнер или российский брутальный фильм «Куратор».",1599912553
149,Причины перевода неизвестны,1599910153
